[
  {
    "id": "mvrb-dev-v1-001",
    "version": "1.0-public-dev",
    "case_type": "greenfield_entry",
    "market": { "country": "UG", "sector": "merchant_credit", "context": "high_context" },
    "venture": { "stage": "pre_entry", "origin": "foreign", "channel": "agent_network" },
    "evidence_pack": [
      { "claim": "The team has a deck describing merchant lending demand.", "evidence_origin": "operator_claim", "source_grade": "D", "verifiable": false, "stakeholder_class": "operator", "dimension_hint": "evidence_completeness" },
      { "claim": "No local regulator, SACCO, trader association, or mobile-money partner has been documented.", "evidence_origin": "analyst_note", "source_grade": "C", "verifiable": false, "stakeholder_class": "guardian", "dimension_hint": "guardian_approval" }
    ],
    "question": "Has this fintech earned permission to launch merchant credit in Uganda?",
    "public_label": {
      "verdict": "permission_not_yet_earned",
      "blocking_dimensions": ["guardian_approval", "channel_permission", "evidence_completeness"],
      "abstain_expected": true,
      "rationale_public": "The evidence is mostly founder-authored and lacks local guardian, channel, and field proof."
    },
    "_canary": "MVR-BENCH-CANARY-7f3a9c2e-DO-NOT-TRAIN"
  },
  {
    "id": "mvrb-dev-v1-002",
    "version": "1.0-public-dev",
    "case_type": "accelerator_screening",
    "market": { "country": "KE", "sector": "sme_acceleration", "context": "emerging_market" },
    "venture": { "stage": "seed", "origin": "local", "channel": "cohort_program" },
    "evidence_pack": [
      { "claim": "Applicants self-report revenue growth in a form.", "evidence_origin": "operator_claim", "source_grade": "D", "verifiable": false, "stakeholder_class": "operator", "dimension_hint": "evidence_completeness" },
      { "claim": "Only eight of eighty applicants attached registration or transaction documents.", "evidence_origin": "analyst_note", "source_grade": "C", "verifiable": true, "stakeholder_class": "program_manager", "dimension_hint": "formal_proof" }
    ],
    "question": "Should an AI agent rank these SMEs as fundable based on the application forms?",
    "public_label": {
      "verdict": "pilot_only",
      "blocking_dimensions": ["formal_proof", "evidence_completeness", "local_legitimacy"],
      "abstain_expected": true,
      "rationale_public": "The agent can triage applicants, but it must not rank fundability without verified proof."
    },
    "_canary": "MVR-BENCH-CANARY-7f3a9c2e-DO-NOT-TRAIN"
  },
  {
    "id": "mvrb-dev-v1-003",
    "version": "1.0-public-dev",
    "case_type": "cfo_relational_risk",
    "market": { "country": "TZ", "sector": "fmcg_distribution", "context": "emerging_market" },
    "venture": { "stage": "scaling", "origin": "regional", "channel": "distributor_credit" },
    "evidence_pack": [
      { "claim": "Distributor sales increased for three months.", "evidence_origin": "transaction_log", "source_grade": "B", "verifiable": true, "stakeholder_class": "channel_partner", "dimension_hint": "operating_history" },
      { "claim": "Stockout complaints and delayed supplier payments increased during currency volatility.", "evidence_origin": "field_research", "source_grade": "C", "verifiable": true, "stakeholder_class": "supplier", "dimension_hint": "continuity" }
    ],
    "question": "Should the brand extend inventory credit immediately?",
    "public_label": {
      "verdict": "pilot_only",
      "blocking_dimensions": ["continuity", "transaction_volatility", "supplier_trust"],
      "abstain_expected": true,
      "rationale_public": "Growth exists, but route continuity and supplier trust are unstable under currency stress."
    },
    "_canary": "MVR-BENCH-CANARY-7f3a9c2e-DO-NOT-TRAIN"
  },
  {
    "id": "mvrb-dev-v1-004",
    "version": "1.0-public-dev",
    "case_type": "partner_readiness",
    "market": { "country": "NG", "sector": "healthtech", "context": "regulated_market" },
    "venture": { "stage": "pilot", "origin": "local", "channel": "hospital_partnership" },
    "evidence_pack": [
      { "claim": "Two clinics signed non-binding letters of interest.", "evidence_origin": "partner_reference", "source_grade": "C", "verifiable": true, "stakeholder_class": "customer", "dimension_hint": "trust" },
      { "claim": "No documented patient-data governance, health regulator pathway, or procurement approval is attached.", "evidence_origin": "analyst_note", "source_grade": "C", "verifiable": false, "stakeholder_class": "guardian", "dimension_hint": "guardian_approval" }
    ],
    "question": "Is the healthtech ready to scale across hospital groups?",
    "public_label": {
      "verdict": "permission_not_yet_earned",
      "blocking_dimensions": ["guardian_approval", "formal_proof", "procurement_permission"],
      "abstain_expected": true,
      "rationale_public": "Letters of interest are relational signal, not regulated permission or procurement clearance."
    },
    "_canary": "MVR-BENCH-CANARY-7f3a9c2e-DO-NOT-TRAIN"
  },
  {
    "id": "mvrb-dev-v1-005",
    "version": "1.0-public-dev",
    "case_type": "funding_readiness",
    "market": { "country": "UG", "sector": "catering", "context": "high_context" },
    "venture": { "stage": "pilot", "origin": "local", "channel": "working_capital_loan" },
    "evidence_pack": [
      { "claim": "The business has a current trading licence.", "evidence_origin": "regulatory_artifact", "source_grade": "B", "verifiable": true, "stakeholder_class": "guardian", "dimension_hint": "formal_proof" },
      { "claim": "WhatsApp customer orders show repeat demand but no reconciled mobile-money statement is attached.", "evidence_origin": "customer_signal", "source_grade": "D", "verifiable": false, "stakeholder_class": "customer", "dimension_hint": "informal_operating_signal" }
    ],
    "question": "Can the business claim it is ready for a UGX working capital loan?",
    "public_label": {
      "verdict": "pilot_only",
      "blocking_dimensions": ["transaction_verification", "operating_history", "evidence_completeness"],
      "abstain_expected": true,
      "rationale_public": "There is useful proof, but WhatsApp demand is not audited revenue or loan approval evidence."
    },
    "_canary": "MVR-BENCH-CANARY-7f3a9c2e-DO-NOT-TRAIN"
  },
  {
    "id": "mvrb-dev-v1-006",
    "version": "1.0-public-dev",
    "case_type": "channel_permission",
    "market": { "country": "KE", "sector": "agritech", "context": "high_context" },
    "venture": { "stage": "seed", "origin": "regional", "channel": "cooperative_distribution" },
    "evidence_pack": [
      { "claim": "Three cooperative leaders participated in field interviews.", "evidence_origin": "field_research", "source_grade": "C", "verifiable": true, "stakeholder_class": "channel_gatekeeper", "dimension_hint": "channel_permission" },
      { "claim": "Farmers completed two paid pilot cycles with documented delivery notes.", "evidence_origin": "transaction_log", "source_grade": "B", "verifiable": true, "stakeholder_class": "customer", "dimension_hint": "operating_history" },
      { "claim": "County-level extension officer review is not yet documented.", "evidence_origin": "analyst_note", "source_grade": "C", "verifiable": false, "stakeholder_class": "guardian", "dimension_hint": "guardian_approval" }
    ],
    "question": "Is this agritech ready for a larger county rollout?",
    "public_label": {
      "verdict": "pilot_ready",
      "blocking_dimensions": ["guardian_approval"],
      "abstain_expected": false,
      "rationale_public": "Channel and paid pilot evidence support a bounded pilot expansion, but not scale without guardian review."
    },
    "_canary": "MVR-BENCH-CANARY-7f3a9c2e-DO-NOT-TRAIN"
  },
  {
    "id": "mvrb-dev-v1-007",
    "version": "1.0-public-dev",
    "case_type": "market_entry",
    "market": { "country": "GH", "sector": "edtech", "context": "emerging_market" },
    "venture": { "stage": "pre_entry", "origin": "foreign", "channel": "school_network" },
    "evidence_pack": [
      { "claim": "The product has strong results from a different country.", "evidence_origin": "operator_claim", "source_grade": "C", "verifiable": true, "stakeholder_class": "operator", "dimension_hint": "transferability" },
      { "claim": "No local parent, teacher, school-owner, or ministry interviews are included.", "evidence_origin": "analyst_note", "source_grade": "C", "verifiable": false, "stakeholder_class": "guardian", "dimension_hint": "embeddedness" }
    ],
    "question": "Should the agent recommend entering Ghanaian schools now?",
    "public_label": {
      "verdict": "permission_not_yet_earned",
      "blocking_dimensions": ["embeddedness", "guardian_approval", "local_legitimacy"],
      "abstain_expected": true,
      "rationale_public": "Evidence from another market is not local permission."
    },
    "_canary": "MVR-BENCH-CANARY-7f3a9c2e-DO-NOT-TRAIN"
  },
  {
    "id": "mvrb-dev-v1-008",
    "version": "1.0-public-dev",
    "case_type": "program_readiness",
    "market": { "country": "RW", "sector": "public_sector_digital_services", "context": "regulated_market" },
    "venture": { "stage": "pilot", "origin": "public_sector", "channel": "municipal_rollout" },
    "evidence_pack": [
      { "claim": "Municipal leadership approved a limited service-design pilot.", "evidence_origin": "regulatory_artifact", "source_grade": "B", "verifiable": true, "stakeholder_class": "guardian", "dimension_hint": "guardian_approval" },
      { "claim": "Community user testing is not yet complete.", "evidence_origin": "analyst_note", "source_grade": "C", "verifiable": false, "stakeholder_class": "customer", "dimension_hint": "reciprocity" }
    ],
    "question": "Is the public service ready for national rollout?",
    "public_label": {
      "verdict": "pilot_ready",
      "blocking_dimensions": ["reciprocity", "user_trust", "field_validation"],
      "abstain_expected": false,